{
  "schema_version": 1,
  "learner_id": "barsuk-05",
  "pseudonym": "Барсук",
  "age_group": "8-9",
  "grade": "3",
  "language": "russian",
  "profile": {
    "explanation_style": "короткими простыми фразами, без длинных объяснений подряд",
    "pace": "медленный, нужны частые перерывы",
    "autonomy_level": "низкий, почти каждый шаг проговаривается вместе",
    "motivation": "физическая активность между заданиями держит интерес",
    "prefers_visual": true
  },
  "interests": [
    "футбол",
    "машинки"
  ],
  "knowledge": [
    {
      "topic_id": "math.g3.numbers.column_addition_subtraction.no_carry",
      "status": "confident",
      "notes": "сложение и вычитание столбиком без перехода — уверенно"
    },
    {
      "topic_id": "math.g3.numbers.column_addition_subtraction.with_carry",
      "status": "needs_support",
      "notes": "с переходом через разряд сбивается, забывает про перенос"
    }
  ],
  "error_patterns": [
    {
      "subject": "math",
      "topic_id": "math.g3.numbers.column_addition_subtraction.with_carry",
      "error_tag": "забывает добавить единицу переноса в следующий разряд",
      "count": 5,
      "last_seen": "2026-07-01"
    },
    {
      "subject": "math",
      "topic_id": "math.g3.numbers.column_addition_subtraction.with_carry",
      "error_tag": "путает порядок разрядов при записи в столбик",
      "count": 2,
      "last_seen": "2026-06-17"
    }
  ],
  "mvp": {
    "story_preferences": [
      "истории про футбольный счёт матчей"
    ],
    "learning_preferences_observed": [
      "после 10-15 минут нужен физический перерыв, иначе теряет внимание"
    ],
    "help_strategies": [
      "делать разминку между блоками примеров",
      "отмечать перенос через разряд ярким кружком над столбиком"
    ],
    "journal": [
      {
        "date": "2026-05-27",
        "note": "Знакомство. Сложение без перехода уверенное, с переходом — сбивается. Ввели перерывы на разминку."
      },
      {
        "date": "2026-06-17",
        "note": "Перенос через разряд по-прежнему теряется. Начали отмечать перенос кружком."
      },
      {
        "date": "2026-07-01",
        "note": "С кружком-подсказкой стало заметно меньше ошибок, но приём ещё нужен постоянно."
      }
    ],
    "points_ledger": [
      {
        "date": "2026-05-27",
        "points": 4,
        "reason": "за терпение на первом занятии",
        "role": "tutor"
      },
      {
        "date": "2026-07-01",
        "points": 5,
        "reason": "за три примера с переходом через разряд подряд без ошибок",
        "role": "tutor",
        "topic_id": "math.g3.numbers.column_addition_subtraction.with_carry"
      }
    ]
  }
}
